{
  "$schema": "http://json-schema.org/draft-07/schema#",
  "$id": "https://github.com/tom2025b/linux-ops-suite/contracts/rexops.snapshot.schema.json",
  "title": "RexOps snapshot",
  "description": "STATUS: PROVISIONAL — RexOps is the suite consumer; this is the unified view it assembles from all producer feeds. RexOps does not yet emit this. This stub fixes only the universal envelope fields. Real shape will be added when RexOps ships its versioned snapshot.",
  "type": "object",
  "required": ["schema_version", "source_tool"],
  "additionalProperties": true,
  "properties": {
    "schema_version": {
      "type": "integer",
      "description": "Integer major version."
    },
    "source_tool": {
      "type": "string",
      "const": "rexops"
    },
    "generated_at": {
      "type": "string",
      "description": "Recommended timestamp (RFC3339 or YYYY-MM-DD)."
    },
    "sources": {
      "type": "object",
      "description": "PROVISIONAL — per-producer availability and last-seen state, so RexOps can report which tools were present.",
      "additionalProperties": true
    },
    "attention": {
      "type": "array",
      "description": "PROVISIONAL — aggregated attention items across the suite.",
      "items": { "type": "object", "additionalProperties": true }
    }
  }
}
