{
  "schema_version": 1,
  "source_tool": "rexops",
  "generated_at": "2026-06-14T00:00:00Z",
  "sources": {
    "workstate": { "present": true, "last_seen": "2026-06-14T00:00:00Z" },
    "bulwark": { "present": true, "last_seen": "2026-06-14T00:00:00Z" },
    "scriptvault": { "present": false, "last_seen": null }
  },
  "attention": [
    {
      "tool": "toolfoundry",
      "id": "backup-home",
      "reason": "health check failing (0/2) and config drifted",
      "severity": "high"
    },
    {
      "tool": "bulwark",
      "id": "deploy-prod.sh",
      "reason": "AWS access key ID detected",
      "severity": "critical"
    }
  ]
}
